"product_id","product_name","fit_id","fabric_id","wash_state","gender","default_inseam_label","colorway","status","nf_product_url","ty_product_url","description_html","release_season","run_code","notes","sku","denim_weight","denim_cat","made_in","product_description"
"easy_guy_le_selvedge_de_la_belle_province_[in_store_exclusive]_raw_easy_guy_la_belle_province_selvedge","Easy Guy - Le Selvedge De La Belle Province [In Store Exclusive]","easy_guy","le_selvedge_de_la_belle_province_[in_store_exclusive]","raw","mens","","indigo/indigo","regular","","https://tateandyoko.com/collections/jeans/products/easy-guy-la-belle-province-selvedge","","","","exclusive","101325906","12.5oz","12.5oz Japanese Selvedge Denim","Made in Quebec","Available In Store Only - Retail Price: $229 CADLe Selvedge de la Belle Province is a 12.5oz Japanese Selvedge Denim inspired by Montreal, Quebec, the home of Naked & Famous Denim.  La Belle Province is the motto of Quebec, which in English, translates to “The Beautiful Province”.  Within Canada, Quebec is distinct as it is a French-speaking nation with its own unique naughty words – which you will find woven right into the selvedge.  You will also notice the fleur de lis along with the white and blue line selvedge id, representing the symbols and colors of Quebec.  The denim is woven using short slub irregular-shaped yarns to give the fabric a gritty look.  The natural veg-tanned leather patch features an alternative edition of the classic tragic blond logo with the words Denim Tout Nu & Célèbre, French for Naked & Famous Denim, as well as some nods to Montreal landmarks.  The artwork was created by local Montreal comic book artist Andy Bélanger.  Other details include contrast stitching, and silver metallic buttons and rivets.This jean was made to celebrate the hometown of Naked & Famous Denim and function as a special souvenir for those making the trip to Montreal.  This is why these jeans will not be available for purchase online, but will be exclusively available for in-store purchase at Tate + Yoko, located at 9096 St. LaurentThe Easy Guy is a relaxed tapered fit; regular rise, fuller in the seat and thigh with a sharp taper from knee to hem.12.5oz Japanese Selvedge Denim100% CottonMade in QuebecSKU: 101325906"
"weird_guy_le_selvedge_de_la_belle_province_[in_store_exclusive]_raw_weird_guy_la_belle_province_selvedge","Weird Guy - Le Selvedge De La Belle Province [In Store Exclusive]","weird_guy","le_selvedge_de_la_belle_province_[in_store_exclusive]","raw","mens","","indigo/indigo","regular","","https://tateandyoko.com/collections/jeans/products/weird-guy-la-belle-province-selvedge","","","","exclusive","101325903","12.5oz","12.5oz Japanese Selvedge Denim","Made in Quebec","Available In Store Only - Retail Price: $229 CADLe Selvedge de la Belle Province is a 12.5oz Japanese Selvedge Denim inspired by Montreal, Quebec, the home of Naked & Famous Denim.  La Belle Province is the motto of Quebec, which in English, translates to “The Beautiful Province”.  Within Canada, Quebec is distinct as it is a French-speaking nation with its own unique naughty words – which you will find woven right into the selvedge.  You will also notice the fleur de lis along with the white and blue line selvedge id, representing the symbols and colors of Quebec.  The denim is woven using short slub irregular-shaped yarns to give the fabric a gritty look.  The natural veg-tanned leather patch features an alternative edition of the classic tragic blond logo with the words Denim Tout Nu & Célèbre, French for Naked & Famous Denim, as well as some nods to Montreal landmarks.  The artwork was created by local Montreal comic book artist Andy Bélanger.  Other details include contrast stitching, and silver metallic buttons and rivets.This jean was made to celebrate the hometown of Naked & Famous Denim and function as a special souvenir for those making the trip to Montreal.  This is why these jeans will not be available for purchase online, but will be exclusively available for in-store purchase at Tate + Yoko, located at 9096 St. Laurent.The Weird Guy is a standard tapered fit with a medium rise, a comfortable top block, and a taper from knee to hem.12.5oz Japanese Selvedge Denim100% CottonMade in QuebecSKU: 101325903"
"weird_guy_left_hand_twill_selvedge_36""_long_inseam_raw_weird_guy_left_hand_twill_selvedge_36_long_inseam","Weird Guy - Left Hand Twill Selvedge - 36"" Long Inseam","weird_guy","left_hand_twill_selvedge_36""_long_inseam","raw","mens","2","indigo/indigo","regular","","https://tateandyoko.com/collections/jeans/products/weird-guy-left-hand-twill-selvedge-36-long-inseam","","","","","012773L","13.75oz","13.75oz Japanese Selvedge Denim","Made in Canada","The Left Hand Twill Selvedge is a 13.75oz indigo rope dyed Japanese selvedge denim, woven on vintage shuttle looms in a left hand twill construction. When worn over time, this construction will provide a softer feeling denim and will emphasize vertical fading. Other details include contrast stitching, full grain brown leather patch, white selvedge ID, silver metallic buttons and rivets. The Weird Guy is a regular tapered fit; medium rise, standard thigh and slight taper from the knee to hem.13.75oz Japanese Selvedge Denim100% CottonMade in CanadaSKU: 012773L"
"easy_guy_solid_black_selvedge_36""_long_inseam_raw_easy_guy_solid_black_selvedge_36_long_inseam","Easy Guy - Solid Black Selvedge - 36"" Long Inseam","easy_guy","solid_black_selvedge_36""_long_inseam","raw","mens","2","black","regular","","https://tateandyoko.com/collections/jeans/products/easy-guy-solid-black-selvedge-36-long-inseam","","","","","101061606L","13oz","13oz Japanese Selvedge Denim","Made in Canada","The Solid Black Selvedge is a 13oz black Japanese selvedge denim. Both the warp and weft are sulfur-dyed black to create a pitch-black denim. The denim is woven on vintage shuttle looms in a right hand twill construction with a classic red line selvedge ID. Cut, sewn, built in Canada with black stitching, a full-grain black leather patch, and black metal buttons and rivets.The Easy Guy is a relaxed tapered fit; regular rise, fuller in the seat and thigh with a sharp taper from knee to hem.13oz Japanese Selvedge Denim100% CottonMade in CanadaSKU: 101061606L"
"weird_guy_jolyne_cujoh_selvedge_raw_weird_guy_jolyne_cujoh_selvedge","Weird Guy - Jolyne Cujoh Selvedge","weird_guy","jolyne_cujoh_selvedge","raw","mens","","indigo/indigo","regular","","https://tateandyoko.com/collections/jeans/products/weird-guy-jolyne-cujoh-selvedge","","window.","","","JOJ282803","12.5oz","12.5oz Japanese Selvedge Denim","Made in Canada","The Jolyne Cujoh Selvedge honors Jotaro Kujo's daughter and the sixth JoJo in the series, Stone Ocean. Crafted from 12.5oz Japanese selvedge denim, the fabric features a vintage aqua blue hue that echoes Jolyne's signature outfit. Woven with irregular-sized slub yarns, the denim emphasizes vertical texture and subtly references Jolyne's unique string-based Stand ability, Stone Free. The jeans are adorned with intricate JoJo details, such as Jolyne's butterfly tattoo symbol on the waist button and a printed pocket bag showcasing Jolyne alongside her Stand, Stone Free. The Selvedge ID comes in a distinctive white and green, and an embossed leather patch featuring Jolyne in a dramatic battle pose adds the finishing touch.The Weird Guy is a standard tapered fit with a medium rise, a comfortable top block, and a taper from knee to hem.12.5oz Japanese Selvedge Denim100% CottonButton FlyMade in CanadaSKU:JOJ282803©LUCKY LAND COMMUNICATIONS/SHUEISHA,JOJO’s Animation SO Project"
"weird_guy_jotaro_kujo_selvedge_raw_weird_guy_jotaro_kujo_selvedge","Weird Guy - Jotaro Kujo Selvedge","weird_guy","jotaro_kujo_selvedge","raw","mens","","indigo/indigo","regular","","https://tateandyoko.com/collections/jeans/products/weird-guy-jotaro-kujo-selvedge","","window.","","","JOJ042903","20oz","20oz Heavyweight Japanese Selvedge Denim","Made in Canada","The Jotaro Kujo Selvedge serves as an homage to perhaps the most iconic JoJo, the lead character from Stardust Crusaders. Crafting a denim worthy of Jotaro Kujo's epic stature required something equally iconic. To meet this challenge, we resurrected Elephant 7—one of the most legendary denims in the history of Naked & Famous Denim. This super heavyweight, big-slub, all-black Japanese selvedge denim tips the scales at 20oz. The all-black color scheme naturally aligns with Jotaro's uniform, while a golden selvedge ID complements the gold accents on his outfit. Created with giant-sized slub yarns, the denim offers maximum texture and grittiness. Further JoJo details are woven throughout: the palm symbol from Jotaro's hat adorns the waist button, a printed pocket bag features Jotaro alongside his Stand, Star Platinum, and an embossed leather patch showcases Jotaro in a fearsome battle pose.The Weird Guy is a standard tapered fit with a medium rise, a comfortable top block, and a taper from knee to hem.20oz Heavyweight Japanese Selvedge Denim100% CottonButton FlyMade in CanadaSKU:JOJ042903©Hirohiko Araki&LUCKY LAND COMMUNICATIONS/SHUEISHA･JOJO’s Animation SC Project"
"easy_guy_mij9_""tennen_ai""_natural_indigo_slub_selvedge_raw_easy_guy_mij9_tennen_ai_natural_indigo_slub_selvedge","Easy Guy - MIJ9 - ""Tennen Ai"" Natural Indigo Slub Selvedge","easy_guy","mij9_""tennen_ai""_natural_indigo_slub_selvedge","raw","mens","","indigo","regular","","https://tateandyoko.com/collections/jeans/products/easy-guy-mij9-tennen-ai-natural-indigo-slub-selvedge","","window.","","","101560106","15oz","15oz Japanese Unsanforized Selvedge Denim","Made in Japan","The MIJ 9 ""Tennen Ai"" Natural Indigo Selvedge is a 15oz Japanese selvedge denim made using 2 kinds of natural indigo dyed yarns. Natural indigo dye is produced in a fermentation process of the Indigofera plant that can take up to 1 year. Unlike synthetic indigo, with natural there is a great deal of color variation from one dye lot to another. For this denim 2 different batches of natural indigo were used to rope dye the cotton yarns. Once woven the result is a denim that has a hand dyed yarn look, as a spectrum of indigo yarns run vertically across the fabric. The denim is unsanforized but tempi treated, which shrinks the fabric but protects the hairiness, grittiness, and raw denim feel. These jeans are made in Japan and feature real iron buttons that will rust, copper rivets that will oxidize, raised belt loops that will fade, a Japanese sheepskin leather patch with the ""Flower of Carnage"" logo, the MIJ maple leaf embroidered onto the back pocket, peek-a-boo selvedge coin pocket, micro busted out seam, and a selvedge button fly. Dyed, woven, cut, sewn, built in Japan.The Easy Guy is a relaxed tapered fit; regular rise, fuller in the seat and thigh with a sharp taper from knee to hem.15oz Japanese Unsanforized Selvedge DenimTempi treated100% CottonMade inJapanSKU:101560106"
"true_guy_smokey_cotton_slub_selvedge_raw_true_guy_smokey_cotton_selvedge","True Guy - Smokey Cotton Slub Selvedge","true_guy","smokey_cotton_slub_selvedge","raw","mens","","indigo/indigo","on-sales","","https://tateandyoko.com/collections/jeans/products/true-guy-smokey-cotton-selvedge","","window.","","","101124221","16oz","16oz Japanese Selvedge Denim","Made in Canada","The Smokey Cotton Slub Selvedge is a 16oz Japanese Selvedge denim, uniquely dyed in a smoky earth tone – a warm, contemporary alternative to traditional indigo raw jeans. Designed to integrate seamlessly into your existing raw denim wardrobe, it offers a refreshing twist to your style when chosen over indigo jeans. This denim boasts an extremely uneven and bumpy texture, achieved through the use of irregularly shaped slub yarns in the weaving process. These yarns vary in thickness, giving the denim a distinctive, flame-like appearance with an emphasis on vertical texture. The low-tension weaving further enhances the fabric's irregularity, endowing it with an almost handwoven feel. Sanforized for minimal shrinkage upon soaking or washing, the Smokey Cotton Selvedge is detailed with tonal stitching, a redline selvedge ID, a brown suede leather patch, and silver metallic buttons and rivets.The True Guy is a straight leg fit with a regular rise along with extra room in the seat and thigh that falls straight from knee to hem.16oz Japanese Selvedge Denim100% CottonButton FlyMade in CanadaSKU: 101124221"
"weird_guy_mij9_""tennen_ai""_natural_indigo_slub_selvedge_raw_weird_guy_mij9_tennen_ai_natural_indigo_slub_selvedge","Weird Guy - MIJ9 - ""Tennen Ai"" Natural Indigo Slub Selvedge","weird_guy","mij9_""tennen_ai""_natural_indigo_slub_selvedge","raw","mens","","indigo","regular","","https://tateandyoko.com/collections/jeans/products/weird-guy-mij9-tennen-ai-natural-indigo-slub-selvedge","","window.","","","101560103","15oz","15oz Japanese Unsanforized Selvedge Denim","Made in Japan","The MIJ 9 ""Tennen Ai"" Natural Indigo Selvedge is a 15oz Japanese selvedge denim made using 2 kinds of natural indigo dyed yarns. Natural indigo dye is produced in a fermentation process of the Indigofera plant that can take up to 1 year. Unlike synthetic indigo, with natural there is a great deal of color variation from one dye lot to another. For this denim 2 different batches of natural indigo were used to rope dye the cotton yarns. Once woven the result is a denim that has a hand dyed yarn look, as a spectrum of indigo yarns run vertically across the fabric. The denim is unsanforized but tempi treated, which shrinks the fabric but protects the hairiness, grittiness, and raw denim feel. These jeans are made in Japan and feature real iron buttons that will rust, copper rivets that will oxidize, raised belt loops that will fade, a Japanese sheepskin leather patch with the ""Flower of Carnage"" logo, the MIJ maple leaf embroidered onto the back pocket, peek-a-boo selvedge coin pocket, micro busted out seam, and a selvedge button fly. Dyed, woven, cut, sewn, built in Japan.The Weird Guy is a standard tapered fit with a medium rise, a comfortable top block, and a taper from knee to hem.15oz Japanese Unsanforized Selvedge DenimTempi treated100% CottonMade inJapanSKU:101560103"
"true_guy_mij12_aomidori_selvedge_(no_embroidery)_raw_true_guy_mij12_aomidori_selvedge_copy","True Guy - MIJ12 - Aomidori Selvedge (No Embroidery)","true_guy","mij12_aomidori_selvedge_(no_embroidery)","raw","mens","","indigo/indigo","regular","","https://tateandyoko.com/collections/jeans/products/true-guy-mij12-aomidori-selvedge-copy","","","","","101056621","16oz","16oz Japanese Selvedge Denim","Made in Japan","*This is a model without the back pocket embroidery. For the model with the embroidery, please visitthis page.Introducing the Aomidori Selvedge, the 12th edition in the Naked & Famous Denim Made in Japan collection. Deriving its name from the Japanese ""Aomidori,"" meaning blue-green, this denim offers a stunning visual twist. At first glance, it resembles traditional indigo denim, yet it uniquely fades to a captivating greenish hue, thanks to an innovative dye technique.There are two primary methods to achieve greencast denim: top dye and bottom dye. The top dye method involves adding a green tint after the indigo, giving the denim an initial green appearance. Conversely, the bottom dye technique, used for the Aomidori Selvedge, applies a green tint before the indigo rope dye process. This unique approach allows the denim to gradually reveal its greenish hue as it fades, setting it apart in both style and wear pattern.Crafted with a robust 16oz weight, the denim is woven on vintage shuttle looms in Okayama, Japan. It remains unsanforized to retain its purest form, free from mechanical shrinkage processes, anti-skewing, or singeing. This preservation enhances the fabric’s texture, characterized by its pronounced vertical streakiness and the irregular sizes of its bumpy yarns, which fade at slightly different rates, adding depth and character to each pair.To maintain its raw, textured appeal, the Aomidori Selvedge undergoes a tempi treatment. This process carefully shrinks the fabric while preserving its distinct characteristics, ensuring you can select your ideal fit from the start.The jeans also boast a variety of expert finishing touches that contribute to its unique character: 100% iron buttons that develop a rust and patina, copper rivets that naturally oxidize, raised belt loops that fade and add dimension with wear, a premium sheepskin leather patch featuring the ""Flower of Carnage"" logo, and selvedge fly.Every element of the Aomidori Selvedge is meticulously crafted in Japan, showcasing the exceptional skill and attention to detail that goes into every step of the production process—from the dyeing of the yarns and the weaving of the fabric to the cutting and sewing of the final garment.The True Guy is a straight leg fit with a regular rise along with extra room in the seat and thigh that falls straight from knee to hem.16oz Japanese Selvedge Denim100% CottonButton FlyRinse-washed, Tempi-treatedMade in JapanSKU:101056621Note: The True Guy features a standard selvedge out seam and not the micro out seam detail as seen in other MIJ models."
"weird_guy_all_natural_organic_cotton_selvedge_raw_weird_guy_all_natural_organic_cotton_selvedge","Weird Guy - All Natural Organic Cotton Selvedge","weird_guy","all_natural_organic_cotton_selvedge","raw","mens","","indigo/indigo","on-sales","","https://tateandyoko.com/collections/jeans/products/weird-guy-all-natural-organic-cotton-selvedge","","window.","","","101660103","14oz","14oz Japanese Selvedge Denim","Made in Canada","The All Natural Organic Cotton Selvedge is a 14oz undyed Japanese selvedge denim made using organic cotton. The cotton is unbleached highlighting it’s natural color. Small brown fragments of the cottonseed are spotted throughout the fabric. Woven on vintage shuttle looms in Okayama, Japan the denim has a classic raw rigid texture. Cut, sewn, built in Canada with tonal stitching, green line selvedge ID, recycled beige leather patch, and silver metallic buttons and rivets.The Weird Guy is a standard tapered fit with a medium rise, a comfortable top block, and a taper from knee to hem.14oz Japanese Selvedge Denim100% Organic CottonButton FlyMade in CanadaSKU:101660103"
"super_guy_le_selvedge_de_la_belle_province_[in_store_exclusive]_raw_super_guy_le_selvedge_de_la_belle_province","Super Guy - Le Selvedge De La Belle Province [In Store Exclusive]","super_guy","le_selvedge_de_la_belle_province_[in_store_exclusive]","raw","mens","","indigo/indigo","regular","","https://tateandyoko.com/collections/jeans/products/super-guy-le-selvedge-de-la-belle-province","","","","exclusive","101325900","12.5oz","12.5oz Japanese Selvedge Denim","Made in Quebec","Available In Store Only - Retail Price: $229 CADLe Selvedge de la Belle Province is a 12.5oz Japanese Selvedge Denim inspired by Montreal, Quebec, the home of Naked & Famous Denim.  La Belle Province is the motto of Quebec, which in English, translates to “The Beautiful Province”.  Within Canada, Quebec is distinct as it is a French-speaking nation with its own unique naughty words – which you will find woven right into the selvedge.  You will also notice the fleur de lis along with the white and blue line selvedge id, representing the symbols and colors of Quebec.  The denim is woven using short slub irregular-shaped yarns to give the fabric a gritty look.  The natural veg-tanned leather patch features an alternative edition of the classic tragic blond logo with the words Denim Tout Nu & Célèbre, French for Naked & Famous Denim, as well as some nods to Montreal landmarks.  The artwork was created by local Montreal comic book artist Andy Bélanger.  Other details include contrast stitching, and silver metallic buttons and rivets.This jean was made to celebrate the hometown of Naked & Famous Denim and function as a special souvenir for those making the trip to Montreal.  This is why these jeans will not be available for purchase online, but will be exclusively available for in-store purchase at Tate + Yoko, located at 9096 St. Laurent.The Super Guy is a skinny fit with a medium rise, a slim top block, and a taper from knee to hem.12.5oz Japanese Selvedge Denim100% CottonMade in QuebecSKU: 101325900"
"weird_guy_deadstock_double_black_selvedge_raw_weird_guy_deadstock_double_black","Weird Guy - Deadstock Double Black Selvedge","weird_guy","deadstock_double_black_selvedge","raw","mens","","black","regular","","https://tateandyoko.com/collections/jeans/products/weird-guy-deadstock-double-black","","window.","","","101418803X","12.5oz","12.5oz Japanese Selvedge Denim","Made in Canada","The Deadstock Double Black Selvedge is a 12.5oz Japanese Selvedge denim dyed black on both the interior warp, and exterior weft for a stealthy all black finish.  The deadstock series features recently found vintage fabrics from the Naked & Famous Denim line that were no longer available, brought back at a great price.  The denim was woven on vintage shuttle looms in Okayama Japan and has a classic raw denim rigid texture.  The selvedge ID is all white, a classic vintage detail, and the only sign of contrast on the entire jean.  Cut, sewn, built in Canada with tonal stitching, black leather patch, and black mil-spec non reflective buttons and rivets.The Weird Guy is a standard tapered fit with a medium rise, a comfortable top block, and a taper from knee to hem.12.5oz Japanese Selvedge Denim100% CottonMade in CanadaSKU:101418803X"
"super_guy_deadstock_double_black_selvedge_raw_superguy_deadstock_double_black","Super Guy - Deadstock Double Black Selvedge","super_guy","deadstock_double_black_selvedge","raw","mens","","black","regular","","https://tateandyoko.com/collections/jeans/products/superguy-deadstock-double-black","","window.","","","101418800X","12.5oz","12.5oz Japanese Selvedge Denim","Made in Canada","The Deadstock Double Black Selvedge is a 12.5oz Japanese Selvedge denim dyed black on both the interior warp, and exterior weft for a stealthy all black finish.  The deadstock series features recently found vintage fabrics from the Naked & Famous Denim line that were no longer available, brought back at a great price.  The denim was woven on vintage shuttle looms in Okayama Japan and has a classic raw denim rigid texture.  The selvedge ID is all white, a classic vintage detail, and the only sign of contrast on the entire jean.  Cut, sewn, built in Canada with tonal stitching, black leather patch, and black mil-spec non reflective buttons and rivets.The Super Guy is a skinny fit with a medium rise, a slim top block, and a taper from knee to hem.12.5oz Japanese Selvedge Denim100% CottonMade in CanadaSKU: 101418800X"
"super_guy_gateway_selvedge_indigo_raw_super_guy_gateway_selvedge_indigo","Super Guy - Gateway Selvedge - Indigo","super_guy","gateway_selvedge_indigo","raw","mens","","indigo","regular","","https://tateandyoko.com/collections/jeans/products/super-guy-gateway-selvedge-indigo","","window.","","","101129600","14.3oz","14.3oz Japanese Selvedge Denim","Made in Canada","The Gateway Selvedge is a 14.3oz Japanese selvedge denim that blends tradition with comfort, featuring 2% stretch for a more accessible raw denim experience. Woven with shorter staple cotton in the warp, this fabric has a gritty, textured surface that embodies the rugged character of classic raw denim. But with 2% elastane in the weft, it offers flexibility and eliminates the typical break-in period, making it the perfect entry point for those new to raw denim. You get the look and feel of rigid denim, with the added comfort of stretch that lasts all day. Key details include contrast stitching, a custom Raging Bull leather patch, pink selvedge ID, exposed selvedge coin pocket, and silver metallic buttons and rivets.The Super Guy is a skinny fit with a medium rise, a slim top block, and a taper from knee to hem.14.3oz Japanese Selvedge Denim98% Cotton, 2% ElastaneButton FlyMade in CanadaSku: 101129600"
"unknown_fit_gateway_selvedge_indigo_raw_weird_guy_gateway_selvedge_indigo","Weird  Guy - Gateway Selvedge - Indigo","unknown_fit","gateway_selvedge_indigo","raw","mens","","indigo","regular","","https://tateandyoko.com/collections/jeans/products/weird-guy-gateway-selvedge-indigo","","window.","","","101129603","14.3oz","14.3oz Japanese Selvedge Denim","Made in Canada","The Gateway Selvedge is a 14.3oz Japanese selvedge denim that blends tradition with comfort, featuring 2% stretch for a more accessible raw denim experience. Woven with shorter staple cotton in the warp, this fabric has a gritty, textured surface that embodies the rugged character of classic raw denim. But with 2% elastane in the weft, it offers flexibility and eliminates the typical break-in period, making it the perfect entry point for those new to raw denim. You get the look and feel of rigid denim, with the added comfort of stretch that lasts all day. Key details include contrast stitching, a custom Raging Bull leather patch, pink selvedge ID, exposed selvedge coin pocket, and silver metallic buttons and rivets.The Weird Guy is a regular tapered fit; medium rise, standard thigh and slight taper from the knee to hem.14.3oz Japanese Selvedge Denim98% Cotton, 2% ElastaneButton FlyMade in CanadaSku: 101129603"
