"product_id","product_name","fit_id","fabric_id","wash_state","gender","default_inseam_label","colorway","status","nf_product_url","ty_product_url","description_html","release_season","run_code","notes","sku","denim_weight","denim_cat","made_in","product_description"
"strong_guy_offshoot_broken_twill_selvedge_raw_strong_guy_offshoot_broken_twill_selvedge","Strong Guy - Offshoot Broken Twill Selvedge","strong_guy","offshoot_broken_twill_selvedge","raw","mens","","indigo/indigo","regular","","https://tateandyoko.com/collections/jeans/products/strong-guy-offshoot-broken-twill-selvedge","","window.","","","101216416","13.75oz","13.75oz Japanese Selvedge Denim","Made in Canada","The Offshoot Broken Twill Selvedge is a 13.75 oz Japanese Selvedge Denim. The Offshoot series represents a reimagining of classic Naked & Famous Denim fabrics in new and interesting ways. For the Offshoot Broken Twill Selvedge we took the warp and weft yarns used in our Left Hand Twill Selvedge, and switched up the construction to Broken Twill. Instead of being a directional twill denim, broken twill denim is woven in a zig zag pattern. With this you’ll be able to see for yourself just how construction can completely change how a denim looks, feels, and fades! The denim has a smooth surface texture and traditional rigid raw denim feel. Cut, sewn, built in Canada with contrast stitching, single blue line and white selvedge ID, full grain brown leather patch, and silver metallic buttons and rivets.The Strong Guy is a relaxed straight fit; high rise, fuller in the seat and thigh that falls to a wide leg opening.13.75oz Japanese Selvedge Denim100% CottonMade in CanadaSKU:101216416"
"easy_guy_love_and_peace_selvedge_raw_easy_guy_love_peace_selvedge","Easy Guy - Love & Peace Selvedge","easy_guy","love_and_peace_selvedge","raw","mens","","indigo/indigo","regular","","https://tateandyoko.com/collections/jeans/products/easy-guy-love-peace-selvedge","","window.","","","101127906","12.5oz","12.5oz Japanese Selvedge Denim","Made in Canada","The Love & Peace Selvedge is a 12.5oz Japanese selvedge denim that follows our playful Vulgar Selvedge, known for its bold selvedge ID with naughty words. This iteration champions a positive vibe, featuring 'Love"" & ""Peace"" woven directly into the selvedge ID. It’s our way of saying, ""Flip the cuff and spread some love."" The fabric presents a crispy and rigid raw denim feel, crafted using short slub yarn. While not overly textured, the short slubs gradually reveal themselves as the denim fades, emphasizing distinct vertical fade patterns. The natural veg-tanned leather patch and pocket flasher are creations of Matt Verdier, a talented artist renowned for his psychedelic retro style artwork. Over time, the leather patch will develop a rich patina, evolving alongside the denim to become even more beautiful with age. Proudly crafted in our Canadian factory, these jeans feature contrast stitching, button fly, and silver metallic hardware.The Easy Guy is a relaxed tapered fit; regular rise, fuller in the seat and thigh with a sharp taper from knee to hem.12.5oz Japanese Selvedge Denim100% CottonButton FlyMade in CanadaSKU:101127906"
"weird_guy_deep_indigo_selvedge_raw_naked_famous_weird_guy_deep_indigo_selvedge","Weird Guy - Deep Indigo Selvedge","weird_guy","deep_indigo_selvedge","raw","mens","","indigo","regular","","https://tateandyoko.com/collections/jeans/products/naked-famous-weird-guy-deep-indigo-selvedge","","","","","015553","15oz","15oz Japanese Selvedge Denim","Made in Canada","The Deep Indigo Selvedge is a 15oz indigo rope dyed Japanese selvedge denim, woven on vintage shuttle looms in a right hand twill construction. The fabric is incredibly rigid which produces distinct wear patterns. Over time with wear, the deep indigo color fades to electric blue hues, resulting in high contrast fades. Other details include contrast stitching, full grain brown leather patch, pink selvedge ID, silver metallic buttons and rivets. The Weird Guy is a regular tapered fit; medium rise, standard thigh and slight taper from the knee to hem.15oz Japanese Selvedge Denim100% CottonMade in CanadaSKU: 015553"
"weird_guy_black_power_stretch_raw_weird_guy_black_power_stretch","Weird Guy - Black Power Stretch","weird_guy","black_power_stretch","raw","mens","","black","regular","","https://tateandyoko.com/collections/jeans/products/weird-guy-black-power-stretch","","","","","013013","12oz","12oz Japanese Denim","Made in Canada","The Black Power Stretch is a 12oz denim dyed black on both the warp and weft for a solid black color tone. The dye is resistant to fading to ensure the jeans stay blacker longer. Made with 5% stretch for increased comfort and incredible stretch recovery performance that allows the jeans to snap back to shape wear after wear. Other details include tonal stitching, full grain black leather patch, silver metallic waist button and rivets. The Weird Guy is a regular tapered fit; medium rise, standard thigh and slight taper from the knee to hem.12oz Japanese Denim95% Cotton / 5% ElastaneMade in CanadaSKU: 013013"
"super_guy_prototype_selvedge_raw_super_guy_prototype_selvedge","Super Guy - Prototype Selvedge","super_guy","prototype_selvedge","raw","mens","","indigo/indigo","on-sales","","https://tateandyoko.com/collections/jeans/products/super-guy-prototype-selvedge","","window.","","collaboration","101585800","15oz","15oz Japanese Selvedge Denim","Made in Canada","Introducing the Prototype Selvedge, a 15oz Japanese selvedge denim made with big slub, irregular-sized yarns to create an incredibly textured denim with a highly visible raised texture. These slub yarns, which alternate between thick and thin sections, create a remarkable texture and impact dye penetration during the rope dyeing process. As a result, sections of the yarn fade at different rates, unveiling a stunning spectrum of indigo hues as the denim ages. This fabric comes from our archives, originally serving as the ""prototype"" for the Pickle Rick selvedge from our Rick & Morty collaboration. Unlike the Pickle Rick style, which features a greencast hue, this denim showcases a classic indigo tone while sharing the same yellow and green selvedge ID. Additionally, the jeans features classic finishing details, including contrast stitching, a button fly, silver metallic hardware, and a brown pull-up leather patch. Each pair is proudly crafted in our Canadian factory.The Super Guy is a skinny fit with a medium rise, a slim top block, and a taper from knee to hem.15oz Japanese Selvedge Denim100% CottonMade in CanadaSKU: 101585800"
"true_guy_revival_frankenstein_denim_raw_true_guy_revival_frankenstein_denim","True Guy - Revival Frankenstein Denim","true_guy","revival_frankenstein_denim","raw","mens","","indigo/indigo","regular","","https://tateandyoko.com/collections/jeans/products/true-guy-revival-frankenstein-denim","","window.","","","101128121","14oz","14oz Japanese Denim","Made in Canada","The Frankenstein Denim is a 14oz Japanese denim, intricately woven in an alternating twill pattern. True to its name, this denim is a mishmash of various construction details. The weave pattern alternates every 2 inches between left-hand twill and right-hand twill throughout the fabric. Since this denim does not adhere to a single twill direction, it cannot undergo anti-skewing, a traditional finishing process designed to eliminate the natural twist of the fabric. Consequently, the sections of left-hand and right-hand twill will twist along their bias over time, enhancing the fabric’s dynamic texture. Crafted with big slub yarns that alternate between thick and thin sections, this denim not only offers an incredible texture but also affects dye penetration during the rope dyeing process. This results in sections of the yarn fading at different rates, revealing a stunning spectrum of indigo hues as the denim ages. Made from 100% cotton, this denim offers a classic rigid raw denim feel. The jeans feature an upside-down leather patch—a distinctive hallmark found only in the Frankenstein Denim series. Proudly crafted in our Canadian factory, these jeans feature contrast stitching, a button fly, and silver metallic hardware.The True Guy is a straight leg fit with a regular rise along with extra room in the seat and thigh that falls straight from knee to hem.14oz Japanese Denim100% CottonButton FlyMade in CanadaSKU:101128121"
"super_guy_mij9_""tennen_ai""_natural_indigo_slub_selvedge_raw_super_guy_mij9_tennen_ai_natural_indigo_slub_selvedge","Super Guy - MIJ9 - ""Tennen Ai"" Natural Indigo Slub Selvedge","super_guy","mij9_""tennen_ai""_natural_indigo_slub_selvedge","raw","mens","","indigo","regular","","https://tateandyoko.com/collections/jeans/products/super-guy-mij9-tennen-ai-natural-indigo-slub-selvedge","","window.","","","101560100","15oz","15oz Japanese Unsanforized Selvedge Denim","Made in Japan","The MIJ 9 ""Tennen Ai"" Natural Indigo Selvedge is a 15oz Japanese selvedge denim made using 2 kinds of natural indigo dyed yarns. Natural indigo dye is produced in a fermentation process of the Indigofera plant that can take up to 1 year. Unlike synthetic indigo, with natural there is a great deal of color variation from one dye lot to another. For this denim 2 different batches of natural indigo were used to rope dye the cotton yarns. Once woven the result is a denim that has a hand dyed yarn look, as a spectrum of indigo yarns run vertically across the fabric. The denim is unsanforized but tempi treated, which shrinks the fabric but protects the hairiness, grittiness, and raw denim feel. These jeans are made in Japan and feature real iron buttons that will rust, copper rivets that will oxidize, raised belt loops that will fade, a Japanese sheepskin leather patch with the ""Flower of Carnage"" logo, the MIJ maple leaf embroidered onto the back pocket, peek-a-boo selvedge coin pocket, micro busted out seam, and a selvedge button fly. Dyed, woven, cut, sewn, built in Japan.The Super Guy is a skinny fit with a medium rise, a slim top block, and a taper from knee to hem.15oz Japanese Unsanforized Selvedge DenimTempi treated100% CottonMade inJapanSKU:101560100"
"easy_guy_indigo_/_indigo_stretch_selvedge_raw_easy_guy_indigo_indigo_stretch_selvedge","Easy Guy - Indigo / Indigo Stretch Selvedge","easy_guy","indigo_/_indigo_stretch_selvedge","raw","mens","","indigo","regular","","https://tateandyoko.com/collections/jeans/products/easy-guy-indigo-indigo-stretch-selvedge","","","","","101027206","12oz","12oz Japanese Selvedge Denim","Made in Canada","The Indigo / Indigo Stretch Selvedge is a 12oz indigo rope dyed Japanese selvedge denim, woven on vintage shuttle looms in a right hand twill construction. The denim is dyed indigo on both the warp and weft for a solid indigo color tone.  Made with 2% stretch for added comfort, without compromising durability. Other details include tonal stitching, full grain navy leather patch, red selvedge ID, silver metallic buttons and rivets.The Easy Guy is a relaxed tapered fit; regular rise, fuller in the seat and thigh with a sharp taper from knee to hem.12oz Japanese Selvedge Denim98% Cotton / 2% ElastaneMade in CanadaSKU: 101027206"
"weird_guy_nightshade_stretch_selvedge_raw_weird_guy_nightshade_stretch_selvedge","Weird Guy - Nightshade Stretch Selvedge","weird_guy","nightshade_stretch_selvedge","raw","mens","","indigo/indigo","regular","","https://tateandyoko.com/collections/jeans/products/weird-guy-nightshade-stretch-selvedge","","","","","101098003","12oz","12oz Japanese Selvedge Denim","Made in Canada","The Nightshade Stretch Selvedge is a 12oz Japanese selvedge denim with 2% stretch for added comfort. The color of the denim is created with the addition of a black dye to the indigo, the combination creates a rich indigo tone that is nearly black. Other details include contrast stitching, brown leather patch, red selvedge ID, silver metallic buttons and rivets. The Weird Guy is a regular tapered fit; medium rise, standard thigh and slight taper from the knee to hem.12oz Japanese Selvedge Denim98% Cotton  /  2% PUMade in CanadaSKU: 101098003"
"easy_guy_10_fold_selvedge_raw_easy_guy_10_fold_selvedge","Easy Guy - 10 Fold Selvedge","easy_guy","10_fold_selvedge","raw","mens","","indigo/indigo","on-sales","","https://tateandyoko.com/collections/jeans/products/easy-guy-10-fold-selvedge","","window.","","","101110006","14oz","14oz Japanese Selvedge Denim","Made in Canada","The 10 Fold Selvedge is a 14oz Japanese selvedge denim crafted from a unique blend of 10 varieties of cotton, sourced from 10 different countries, and featuring a distinctive 10-color selvedge ID. Originally produced for the 10th anniversary of Naked & Famous Denim, we had some unused rolls from the initial production that we saved for the perfect moment to re-release this fabric. This denim has a classic rigid raw feel, made with short slub yarns that add a subtle touch of character while preserving a traditional raw denim experience. Flip the cuff to reveal the multicolor selvedge ID. The jeans boast classic finishing details, including contrast stitching, a button fly, silver metallic hardware, and a natural veg-tan leather patch. Each pair is proudly crafted in our Canadian factory.The Easy Guy is a relaxed tapered fit; regular rise, fuller in the seat and thigh with a sharp taper from knee to hem.14oz Japanese Selvedge Denim100% CottonMade in CanadaSKU:101110006"
"easy_guy_solid_black_selvedge_raw_easy_guy_solid_black_selvedge","Easy Guy - Solid Black Selvedge","easy_guy","solid_black_selvedge","raw","mens","","black","regular","","https://tateandyoko.com/collections/jeans/products/easy-guy-solid-black-selvedge","","","","","101061606","13oz","13oz Japanese Selvedge Denim","Made in Canada","The Solid Black Selvedge is a 13oz black Japanese selvedge denim. Both the warp and weft are sulfur-dyed black to create a pitch-black denim. The denim is woven on vintage shuttle looms in a right hand twill construction with a classic red line selvedge ID. Cut, sewn, built in Canada with black stitching, a full-grain black leather patch, and black metal buttons and rivets.The Easy Guy is a relaxed tapered fit; regular rise, fuller in the seat and thigh with a sharp taper from knee to hem.13oz Japanese Selvedge Denim100% CottonMade in CanadaSKU: 101061606"
"weird_guy_black_cobra_stretch_selvedge_raw_naked_famous_weird_guy_black_cobra_stretch_selvedge","Weird Guy - Black Cobra Stretch Selvedge","weird_guy","black_cobra_stretch_selvedge","raw","mens","","black","regular","","https://tateandyoko.com/collections/jeans/products/naked-famous-weird-guy-black-cobra-stretch-selvedge","","","","","101904003","12oz","12oz Japanese Stretch Selvedge Denim","Made in Canada","The Black Cobra Stretch Selvedge is a 12oz Japanese selvedge denim with a black warp and a black weft to create a pitch-black denim, the only flash of color comes from the red line selvedge ID. The standard weight fabric can be worn year-round, and the touch of stretch offers comfort and flexibility without compromising durability. Cut, sewn, built in Canada with black stitching, a black full grain leather patch, and mil-spec non-reflective black metal buttons and rivets. The Weird Guy is a standard tapered fit with a medium rise, a comfortable top block, and a taper from knee to hem.12oz Japanese Stretch Selvedge Denim98% Cotton / 2% ElastaneMade in CanadaSKU: 101904003"
"easy_guy_deadstock_real_gold_selvedge_raw_easy_guy_deadstock_real_gold_selvedge","Easy Guy - Deadstock Real Gold Selvedge","easy_guy","deadstock_real_gold_selvedge","raw","mens","","indigo/indigo","on-sales","","https://tateandyoko.com/collections/jeans/products/easy-guy-deadstock-real-gold-selvedge","","window.","","","101173706X","12.5oz","12.5oz Japanese Selvedge Denim","Made in Canada","The Real Gold Selvedge is a 12.5oz Japanese Selvedge Denim made with cotton and just a hint of real gold, giving the selvedge ID a golden shine! The denim itself features a classic rigid raw denim look and feel, made with short slub yarns that add depth to the fabric. As the denim fades, these short slub yarns create vertical highlights throughout. While the denim is classic, the selvedge ID is anything but—it features an 18k gold yarn custom spun for Naked & Famous Denim. This gold detail is prominently featured on the exposed selvedge coin pocket and the selvedge outseam when you flip up your cuff. The jeans boast classic finishing details, including contrast stitching, a button fly, silver metallic hardware, and a natural veg-tan leather patch. Each pair is proudly crafted in our Canadian factory.The Easy Guy is a relaxed tapered fit; regular rise, fuller in the seat and thigh with a sharp taper from knee to hem.12.5oz Japanese Selvedge Denim99.6% Cotton / 0.4% GoldMade in CanadaSKU: 101173706X"
"weird_guy_duck_canvas_selvedge_raw_naked_famous_weird_guy_selvedge_duck","Weird Guy - Duck Canvas Selvedge","weird_guy","duck_canvas_selvedge","raw","mens","","indigo/indigo","regular","","https://tateandyoko.com/collections/jeans/products/naked-famous-weird-guy-selvedge-duck","","","","","012143","10oz","","Made in Canada","The Duck Canvas Selvedge is a 10oz Japanese duck canvas woven on vintage shuttle looms in a tightly woven plain weave construction. Used primarily as work wear because of its strength and durability, the fabric also has a relatively smooth surface making it less prone to snagging and tearing. Duck canvas was once the fabric of choice to make jeans before denim became popular in the late 1800¢‚¬„¢s. Other details include tonal stitching, full grain brown leather patch, red selvedge ID, silver metallic  buttons and rivets. The Weird Guy is a regular tapered fit; medium rise, standard thigh and slight taper from the knee to hem.10oz Japanese Duck Canvas100% CottonMade in CanadaSKU: 012143"
"easy_guy_mij10_okayama_spirit_raw_easy_guy_mij10_okayama_spirit","Easy Guy   -   MIJ10   -   Okayama Spirit","easy_guy","mij10_okayama_spirit","raw","mens","","indigo/indigo","regular","","https://tateandyoko.com/collections/jeans/products/easy-guy-mij10-okayama-spirit","","","","","101505006","16oz","16oz Japanese Selvedge Denim","Made in Japan","The Naked & Famous Denim Made in Japan (MIJ) collection is celebrating its 10th iteration with the return of a fan favorite: the iconic Okayama Spirit Selvedge. This marks the first time the original has been rereleased since it was first released in 2013.The Okayama Spirit is a 16oz unsanforized slubby Japanese selvedge denim that is dyed using the indigo rope dyeing process. In this process, cotton yarns are repeatedly run through vats of indigo dye, but not long enough for the dye to fully penetrate the yarn core. This creates a unique pattern in the fabric as thicker sections of the yarn absorb more indigo and thinner sections absorb less. The yarns themselves also have an irregular, slubby texture which adds to the overall texture of the fabric. To further enhance the texture, the denim is slowly woven on vintage shuttle looms, which creates a wavy weave pattern when viewed up close. The combination of the irregular slubby yarns and the loose weaving of the fabric gives it an organic, uneven grain that is signature of the Okayama Spirit's iconic textured look.To preserve the hairiness, grittiness, and raw denim feel of this unsanforized denim, the MIJ10 undergoes a tempi treatment which shrinks the fabric while maintaining its texture. This removes the guesswork from sizing and allows you to get the correct size from the start. The MIJ10 also features a range of finishing touches that add to its character and appeal. These include 100% iron buttons that will rust, copper rivets that will oxidize, raised belt loops that will fade, a Japanese sheepskin leather patch with the ""Flower of Carnage"" logo, a selvedge button fly, and a micro busted outseam. The jeans also feature a maple leaf embroidered onto the back pocket, a signature of the MIJ series.The MIJ10 is made in Japan from start to finish, ensuring its high quality. The expert craftsmanship that goes into each pair is evident in the attention to detail and care taken at every stage of the production process, from the dyeing of the yarn, weaving of the fabric, to the cutting and sewing of the denim.The Easy Guy is a relaxed tapered fit; regular rise, fuller in the seat and thigh with a sharp taper from knee to hem.16oz Japanese Selvedge Denim100% CottonButton FlyRinse-washed, Tempi-treatedMade in JapanSKU:101505006"
"strong_guy_dirty_fade_selvedge_raw_naked_famous_denim_strong_guy_dirty_fade_selvedge","Strong Guy - Dirty Fade Selvedge","strong_guy","dirty_fade_selvedge","raw","mens","","indigo/indigo","regular","","https://tateandyoko.com/collections/jeans/products/naked-famous-denim-strong-guy-dirty-fade-selvedge","","","","","101085316","14.5oz","","Made in Canada","The Dirty Fade Selvedge is a 14.5oz indigo rope dyed Japanese selvedge denim, woven on vintage shuttle looms in a right hand twill construction. The indigo dyed warp yarns start off as a dusty brown shade of cotton. Over time with wear, layers of indigo will begin fade away revealing a brown undertone, hence the name Dirty Fade. Other details include contrast stitching, roughout tan leather patch, red selvedge ID, silver metallic buttons and rivets.The Strong Guy is a relaxed straight fit; high rise, fuller in the seat and thigh that falls to a wide leg opening.Scroll through all the product photos to see the dramatic transformation of how the Dirty Fade Selvedge can fade over time with extended period of wear and wash. The model shown is wearing the Super Guy fit.100% CottonJapanese fabricMade in CanadaSKU: 101085316"
"super_guy_wax_coated_black_stretch_raw_naked_famous_denim_super_guy_wax_coated_black_stretch","Super Guy - Wax Coated Black Stretch","super_guy","wax_coated_black_stretch","raw","mens","","black","regular","","https://tateandyoko.com/collections/jeans/products/naked-famous-denim-super-guy-wax-coated-black-stretch","","","","","015590","12oz","12oz Japanese Denim","Made in Canada","The Wax Coated Black Stretch is a 12oz black Japanese power stretch denim, woven in a right hand twill construction. The denim is dyed black on both the warp and weft for a solid black color tone. A paraffin wax coating is then applied to give the fabric a leather like shine. The dye is resistant to fading to ensure the jeans stay blacker longer. The denim is made with 2% stretch for increased comfort, and has an incredible stretch recovery performance allowing the jeans to snap back to shape wear after wear. Other details include tonal stitching, full grain black leather patch, black metal waist button and rivets. The Super Guy is a slim tapered fit; medium rise, slim thigh and taper from the knee to hem.12oz Japanese Denim98% Cotton / 2% PolyurethaneMade in CanadaSKU: 015590"
"easy_guy_mij12_aomidori_selvedge_raw_easy_guy_mij12_aomidori_selvedge","Easy Guy - MIJ12 - Aomidori Selvedge","easy_guy","mij12_aomidori_selvedge","raw","mens","","indigo/indigo","regular","","https://tateandyoko.com/collections/jeans/products/easy-guy-mij12-aomidori-selvedge","","","","","101056606","16oz","16oz Japanese Selvedge Denim","Made in Japan","Introducing the Aomidori Selvedge, the 12th edition in the Naked & Famous Denim Made in Japan collection. Deriving its name from the Japanese ""Aomidori,"" meaning blue-green, this denim offers a stunning visual twist. At first glance, it resembles traditional indigo denim, yet it uniquely fades to a captivating greenish hue, thanks to an innovative dye technique.There are two primary methods to achieve greencast denim: top dye and bottom dye. The top dye method involves adding a green tint after the indigo, giving the denim an initial green appearance. Conversely, the bottom dye technique, used for the Aomidori Selvedge, applies a green tint before the indigo rope dye process. This unique approach allows the denim to gradually reveal its greenish hue as it fades, setting it apart in both style and wear pattern.Crafted with a robust 16oz weight, the denim is woven on vintage shuttle looms in Okayama, Japan. It remains unsanforized to retain its purest form, free from mechanical shrinkage processes, anti-skewing, or singeing. This preservation enhances the fabric’s texture, characterized by its pronounced vertical streakiness and the irregular sizes of its bumpy yarns, which fade at slightly different rates, adding depth and character to each pair.To maintain its raw, textured appeal, the Aomidori Selvedge undergoes a tempi treatment. This process carefully shrinks the fabric while preserving its distinct characteristics, ensuring you can select your ideal fit from the start.The jeans also boast a variety of expert finishing touches that contribute to its unique character: 100% iron buttons that develop a rust and patina, copper rivets that naturally oxidize, raised belt loops that fade and add dimension with wear, a premium sheepskin leather patch featuring the ""Flower of Carnage"" logo, a selvedge fly, and a micro busted outseam. Additionally, a maple leaf embroidered on the back pocket adds a signature touch, encapsulating the heritage of the MIJ series.Every element of the Aomidori Selvedge is meticulously crafted in Japan, showcasing the exceptional skill and attention to detail that goes into every step of the production process—from the dyeing of the yarns and the weaving of the fabric to the cutting and sewing of the final garment.The Easy Guy is a relaxed tapered fit; regular rise, fuller in the seat and thigh with a sharp taper from knee to hem.16oz Japanese Selvedge Denim100% CottonButton FlyRinse-washed, Tempi-treatedMade in JapanSKU:101056606"
